Unnamed: 0,Carnes HBE,Precio Carnes HBE,Carnes Chedraui,Precio Carnes Chedraui,Carnes Soriana,Precio Carnes Soriana,Carnes LaComer,Precio Carnes LaComer
,Arrachera De Pavo Mezquite Pimienta 500 Gr,57.9,Pierna y Muslo Americano Fresco de Pollo kg,25.9,Diezmillo De Res S/Hueso Rdfs Kg,69.0,Chuleta Ahumada Cerdo Selecto,91.0
,Arrachera De Pavo Sabor Finas Hierbas 500 Gr,60.9,Codillo Chamorro de Cerdo kg,47.0,Costilla De Res P/Asar Rdfs Kg,67.9,Molida Cerdo Selecto,111.0
,Cubos De Pavo Natural 500 Gr,99.9,Molida Selecta de Res kg,144.0,Flecha De Res P/Asar Rdfs Kg,67.9,Pulpa De Pierna Cerdo Selecto,115.7
,Milanesa De Pavo Natural 500 Gr,99.9,Retazo con Hueso para caldo de res,89.0,Higado De Res Rebanado Sukarne 500 Gr,28.9,Costilla Cerdo Selecto,118.5
,Arrachera De Pavo Natural 500 Gr,60.9,Molida de Res kg,68.9,Filete De Res Rdfs Kg,19.0,Chuleta Cerdo Selecto,104.61
,Fajitas De Pavo Natural 500 Gr,99.9,ARTMOD Carnes Res,62.0,Molida Res Pulpa Negra 95/5 Rancho Don Francisco,84.0,Lomo Cerdo Supremo,121.4
,Molida De Pavo Natural 500 Gr. 500 Gr,95.9,Hamburguesa vegetal 227g,99.0,Menudo De Res Panza Rancho Santa Fe Kg,74.9,Filete Cerdo Selecto,145.4
,Molida Pulpa Negra De Res 500 Gr,109.0,Molida Vegetal 456g,174.0,Molida De Pulpa Negra London Broil Rancho Don Francisco Selecta Kg,19.0,Milanesa De Pierna Cerdo Selecto,115.0
,Molida London Broil De Res 500 Gr,119.0,Rib Eye Viba Res 340g,125.0,Pulpa Negra Trozo Rancho Don Francisco Selecta,84.0,Codillo Cerdo Selecto,64.0
,Molida Pulpa Fina De Res 300 Gr,59.9,Bistec Pulpa Blanca de Res kg,144.0,New York De Res Rdfs Kg,14.0,Espinazo Cerdo Selecto,131.9
,Molida Sirloin De Res 300 Gr,61.9,Milanesa de Res Kg,144.0,Milanesa De Res Pulpa Negra Rancho Don Francisco Selecta Kg,79.9,Milanesa De Lomo Cerdo Selecto,139.8
,Pechuga De Pollo S/H 1 Kg,133.0,Carne de Cerdo tipo Trompo Mi Granja San Agustín 500g,44.9,T Bone De Res Rdfs Kg,9.0,Bistec De Pierna Cerdo Selecto,123.8
,Milanesa Natural De Pollo Paq.De.550Gr 550 Gr,86.9,Milanesa Nutrypol Pech Pol Doupack Kg,147.0,Molida 90/10 De Res Rancho Don Francisco Selecta Kg,64.9,Lomo Ahumado Cerdo Selecto,122.86
,Milanesa De Pulpa Negra 1 Kg,219.0,Hamburguesa Aires de Campo de Pollo Orgánica 6 Piezas,180.0,Brisket De Res S/Hueso Rdfs Kg,49.0,Manitas Cerdo Selecto,62.2
,Pechuga De Pollo Deshuesada 1 Kg,138.9,Nugget Aires de Campo de Pollo Orgánico 700g,199.0,Pulpa Trozo P. Bola De Res Rancho Don Francisco Selecta Kg,49.9,Carrillera Baby Back Cerdo Selecto,134.0
,Pierna Con Muslo De Pollo Corte Americano Fres 1 Kg,25.9,Carne Nutrypol al Pastor 500 gr,73.9,Hueso De Res Tuetanero Rancho Santa Fe Kg,79.9,Cabeza De Lomo Sin Hueso Cerdo Selecto,107.0
,Alco Milanesa Corazon 170 Gr. 170 Gr,29.9,Fajitas Nutrypol Pech Hierba Fina 500 gr,83.9,Carne De Res P/Asar Rdfs Kg,49.9,Espaldilla Con Hueso Cerdo Selecto,86.0
,Molida Clásica De Res 1 Kg,149.0,Fajitas Nutrypol Pechuga Jalapeño 500 gr,83.9,Sirloin De Res C/H Rdfs Kg,39.9,Hueso Pozolero Cerdo Selecto,40.4
,Fajita De Pollo 1 Kg,143.0,Salchichas Aires de Campo de Pollo Orgánico 400g,99.0,Carne Para Jugo De Pulpa Negra Rancho Don Francisco Selecta Kg,84.0,Cabeza De Lomo Cerdo Selecto,108.8
,Pechuga De Pollo C/H S/Piel Empacada 1 Kg,140.9,Pollo Asar Pilgrims IQF Sobor Cerveza 1,44.9,Carne Trocitos De Res Rancho Don Francisco Selecta Kg,34.9,Rib Eye Cerdo Selecto,148.1
,Muslo De Pollo Paq.Reg. 1 Kg,68.9,Alas Pilgrims IQF Adobadas 500 gr,22.0,Tampiqueña En Tiras Rancho Don Francisco Selecta,84.0,Milanesa De Pechuga Pollo Selecto,135.0
,Pierna Y Muslo De Pollo Iqf 1 Kg,25.9,Chamorritos Pilgrims IQF Pizza 460 gr,26.9,Carne Para Deshebrar De Res Rancho Don Francisco Selecta Kg,34.9,Pechuga Con Hueso Sin Piel Pollo Selecto,103.96
,Molida De Res 95/5 400 Gr,70.9,Chamorritos Pilgrims IQF Chamoy 460 gr,26.9,Costilla De Rib Eye Rancho Don Francisco Premium,64.9,Pechuga Con Hueso Americano Pollo Selecto,68.5
,Filete De Mojarra Natural 1 Kg,149.0,Chamorritos Pilgrims IQF Nachiqueso 460,26.9,Hamburgesa De Res 90 / 10 Na Rdfs Kg,99.9,Pechuga S/H Cong,132.08
,Pechuga Entera C/H De Pollo Bolsa 1 Kg,108.5,Filete de Pescado Marinado Pimienta Limón Rivera 500g,106.0,Milanesa De Cerdo Fresca 1 Kilo,89.9,Muslo Sin Piel Pollo Selecto,69.0
,Pierna De Cerdo C/H Rebanada 1 Kg,79.9,Filete Pescado Marinado al Ajillo Rivera 500g,93.85,Chuleta Mixta De Lomo De Cerdo 1 Kg,79.9,Filete De Pechuga Pollo Selecto,114.0
,Chuleta Ahumada Paq. Fam 1 Kg,89.9,Sopa de Mariscos Gourmet Rivera 500g,126.0,Tortita De Papa 1 Kilo,64.9,Pierna Sin Piel Pollo Selecto,72.7
,Milanesa De Pollo Premium 500 Gr,96.9,Filete Tilapia Natural Rivera 600g,106.0,Lomo De Cerdo Ahumado 1 Kg,99.9,Muslo Pollo Selecto,62.0
,Heb Fajitas De Pechuga De Pollo Bolsa De 1 Kg,131.0,Filete Rivera Tilapia Quinoa . 500 g,109.0,Cabeza Cerdo Kg,36.9,Pechuga Sin Hueso Pollo Selecto,126.4
,Muslo S/Rs/Piel Empacado 1 Kg,80.9,Robalo Gourmet Rivera 500g,325.0,Costilla Cerdo Huesitos Congelada 1 Kilo,79.9,Milanesa De Pechuga Congelada Pollo Selecto,140.5
,Milanesa Marinada D/Pollo Paq.De 550 Gr,86.9,Filete Tilapia Natural Rivera 1 Kg,173.0,Pierna Cerdo S/Hueso Fresca Kg,86.9,Molida De Pechuga Pollo Selecto,130.0
,Pechuga C/H De Pollo 1 Kg,108.5,Filete Pescado Marinado al Ajillo Rivera 1 Kg,183.0,Don Francisco Selecta Hueso De Cerdo Para Pozole 1 Kg,26.9,Pierna Con Muslo Americano Pollo Selecto,37.86
,Costilla Norteña S/H De Res 1 Kg,167.0,Filete Tilapia a la Talla Rivera 600g,110.0,Chuleta De Cerdo Fresca 1 Kg,89.9,Pierna Con Muslo Sin Piel Pollo Selecto,69.4
,Filete De Mojarra Granja En Bolsa 900 Gr,104.0,Pato Entero kg,178.0,Lomo Cerdo Natural Kg,89.0,Pechuga Anatomic,99.32
,Carbon Mezquite De 3 Kg,56.9,Filete de Tilapia por Kg,89.9,Pulpa Trocitos/ Espaldilla De Cerdo 1 Kg,84.9,Canal Entera Pollo Selecto,38.0
,Molida De Res 90/10 400 Gr,62.9,Camarón Pacotilla Coctelero por kg,149.0,Costilla De Cerdo Cargada Fresca 1 Kg,19.0,Pierna Pollo Selecto,62.0
,Top Sirloin 1 Kg,199.0,Camarón U12 por Kg,549.0,Espinazo De Cerdo 1 Kg,34.9,Pierna Con Muslo Pollo Selecto,62.0
,Molida De Res 80 / 20 400 Gr,50.9,Camarón U15 por Kg,449.0,Manitas Cerdo Kg,64.9,Rabadilla Pollo Selecto,22.8
,Carne De Cerdo Tipo Trompo 500 Gr,59.9,Filete de Salmón Pacifico por Kg,299.0,Pierna De Cerdo C/Hue Cong Sta Fe 1 Kg,59.9,Alas Pollo Selecto,68.4
,Carne De Res Deshebrada 300 Gr,105.0,Fajita Tpo Arrachera Marin Res Diablo Kg,99.9,Kacer Chicharron Prensado 1 Kg,52.0,Canal Entera Partida Pollo Selecto,60.84
,Pierna Bate S/Piel Empacado 1 Kg,80.9,Churrasco Estabulado Res kg,209.0,Codillo/Chamorro Cerdo Kg,49.9,Molida Sirloin 95/5 Res Selecta,179.0
,Bistec S/H Para Asar De Res Supreme 1 Kg,169.0,Picana Estabulada Res kg,249.0,Costilla Cerdo Especial Kg,59.9,Milanesa De Centro Res Selecta,196.0
,Filete Tilapia Granja Grande 1 Kg,139.0,Cow boy choice Angus Res kg,499.0,Costilla Huesitos De Cerdo Fresca 1 Kilo,59.9,Milanesa De Bola Res Selecta,187.0
,Lomos De Salmon Prev. Cong. 1 Kg,410.0,Rib Eye Choice Res kg,549.0,Chuleta Lomo Cerdo Ahumada Kg,94.9,Deshebrada Res Selecta,159.9
,Picaña De Res Fresca 1 Kg,269.0,Filete Tampiquena Res kg,419.0,Costilla Cerdo Baby Back Kg,19.0,Bistec Para Asar Res Selecta,169.3
,Cortadillo De Sirloin P/Guisar 1 Kg,189.0,Molida Res Kosher kg,239.0,Cuero Cerdo Kg,39.9,Molida Selecta 80/20 Res Selecta,177.0
,Arrachera De Res Marinada 600 Gr,159.0,Chambarete sin Hueso Res Kosher kg,254.0,Pulpa Trozo /Espaldilla De Cerdo 1 Kg,84.9,Fajita De Centro Res Selecta,198.0
,Milanesa De Pollo Congelada Bolsa 750 Gr,119.0,Milanesa Bola de Res kg,178.0,Chuleta Adobada Rebanada 1 Kg,58.9,Chambarete Sin Hueso Res Selecta,155.0
,Muslos De Pollo Amarillo S/Raba Empacado 1 Kg,76.9,Suadero Res kg,147.0,Milanesa De Pollo Bachoco Char,34.0,Bistec De Diezmillo Res Selecta,170.4
,Costilla Norteña S/H De Res 1 Kg,171.0,Tampiqueña Res Kosher kg,264.0,Pechuga De Pollo Sin Piel 1 Pz Kg,19.9,Bistec De Aguayon Res Selecta,198.0
,Deshebrada De Pulpa Negra 1 Kg,209.0,Pulpa Trozos Res kg,159.0,Pechuga C/Hueso S/Rabadilla Fresca Kg,86.0,Chambarete Con Hueso Res Selecta,104.9
,Milanesa De Pulpa Negra Junior 1 Kg,239.0,Pulpa Res Kosher kg,261.0,Milanesa De Pollo Natural Alco Char,74.9,Tampiqueña De Filete Res Selecta,454.0
,Molida De Cerdo 1 Kg,69.9,Tampiqueña para asar de Pulpa Negra Kg,194.0,Deshebrada De Pollo Sk 300Gr,51.25,Carne Para Asar Res Selecta,175.0
,Aguja Norteña C/H De Res 1 Kg,169.0,Escalopas Filete Estabulado Res kg,419.0,Pierna Con Muslo De Pollo,52.0,Molida Mixta Res Mixto,125.0
,Salchicha Ahumada Polaca 396 Gr,59.9,Panza Cocida Res Kg,74.0,Pechuga De Pollo Sin Hueso Fresca 1 Kg,19.0,Medallon De Filete Res Selecta,451.0
,Fajita De Pechuga Natural 500 Gr,79.9,Pata Picada Cocida Res Kg,44.0,Pierna Bate Pollo Kg,32.0,Milanesa De Contra Res Selecta,176.6
,Milanesa De Sirloin De Res 1 Kg,209.0,Pata Cruda Res Kg,59.0,Alas Pollo Marinada Bachoco Char,84.9,Bistec Ranchero Res Selecta,158.0
,Cubo Cevichero De Tun Rojo Dolores 200 Gr,58.9,Cortadillo Res kg,174.0,Nugget De Pollo Del.Dia Char,39.9,Pulpa Para Estofado Res Selecta,171.0
,Vampiros De Pulpa Negra En Trocitos 1 Kg,249.0,Molida Mixta Res/Cerdo kg,134.0,Pechuga De Pollo Rellena Del.Dia Char,51.9,Rib Eye Res Selecta,335.0
,Milanesa De Pechuga Aplanada Charola 1 Kg,160.0,Molida fina de Res 95/5 kg,172.0,Fajita De Pollo Empanizada Del.Dia Char,39.9,Pulpa Fina Res Selecta,171.0
